{
  "$schema": "ProjectSpec.schema.json",
  "metadata": {
    "document_id": "project_spec.json",
    "title": "Project Spec",
    "purpose": "This file, together with the other docs under ./project_spec/, is the authoritative invariant space for harnessed work in this repo",
    "source_format": "json",
    "document_authority": "invariant_authority"
  },
  "project_thesis": {
    "project_is": [
      "A local Python/JSON coding-agent CLI harness.",
      "A system that orchestrates clean-context coding agents by treating role contracts, project context packet, governance runtime, runtime_outputs schemas, runtime reports, and acceptance evidence as explicit structured artifacts.",
      "A harness exists to make agent-assisted software work inspectable, bounded, reproducible, and governed."
    ],
    "project_is_not": {
      "excluded_product_forms": [
        "A chatbot UI.",
        "An IDE extension.",
        "A generic RAG assistant.",
        "An autonomous repo mutator.",
        "A replacement for repo-specific project specs.",
        "A framework for giving an LLM broad ambient access to files, shell commands, or tool permissions."
      ],
      "excluded_agent_patterns": [
        "An agent \"team\" simulation where agents freely call each other.",
        "A prompt collection where behavior depends on conversational momentum.",
        "A hidden-memory system that treats prior chat as implementation authority."
      ],
      "design_guardrail": [
        "The harness does not try to make coding agents more magical. It tries to make their participation in software work more explicit, auditable, and bounded."
      ]
    },
    "project_exists_to": {
      "delineate_boundaries": [
        "Prompt versus policy.",
        "Context versus authority.",
        "Scaffold versus runtime behavior.",
        "Planning versus implementation.",
        "Model claim versus probe evidence.",
        "Agent role versus tool permission.",
        "User instruction versus project invariant.",
        "Chat memory versus repo-local implementation state."
      ],
      "instantiate_governance": [
        "Controlling what context enters each agent call.",
        "Separating role semantics from runtime mechanics.",
        "Forcing structured reports instead of vague advice.",
        "Recording evidence of what actually happened.",
        "Preventing implementation from being treated as admissible merely because an agent wrote a plausible plan.",
        "Keeping review and proof tied to repo-local artifacts, not chat history."
      ]
    },
    "core_runtime_shape": [
      "A CLI entrypoint receives a user task.",
      "The orchestrator selects a bounded workflow.",
      "Project Context Packet compiles a structured runtime_inputs for agents.",
      "Role contracts define what each agent is allowed to do and how it should interpret the packet.",
      "The Responses API is used for bounded semantic transformation calls.",
      "Report schemas define machine-checkable runtime_outputs shapes.",
      "Runtime probes and saved artifacts distinguish scaffold claims from live-wired behavior.",
      "Worker adapters are isolated from governance roles and require explicit authorization before file mutation.",
      "The system is a governance runtime first, not an autonomy demo."
    ],
    "primary_operator": "Primary operator is the project authority using agent assistance to build software wanting stronger control over context, authority, tool permissions, and evidence than a normal chat interface or IDE extension provides.",
    "highest_value_workflow": {
      "command": "python",
      "args": [
        "-m",
        "harness",
        "plan",
        "TASK TEXT"
      ],
      "expectations": [
        "Compile repo-local context into a structured project context packet.",
        "Load the relevant role contract.",
        "Call the Responses API.",
        "Receive a structured admissibility report.",
        "Validate that report against the schema.",
        "Save the task brief, project context packet, and report under ../runs/<timestamp>/",
        "Print a short terminal summary.",
        "Identify the next admissible transformation."
      ],
      "stop_condition": "Stop before implementation"
    }
  },
  "non_goals": {
    "do_not_build": [
      "A web UI.",
      "A desktop UI.",
      "A VS Code extension.",
      "A generic autonomous coding agent.",
      "A generic task manager.",
      "A vector database or RAG system.",
      "Automatic repo mutation from a planning command.",
      "Broad shell/tool access for governance agents.",
      "Recursive agent self-improvement.",
      "Model-provider abstraction beyond what is needed for the first Responses API path.",
      "Free-form multi-agent group chat."
    ],
    "do_not_fake": [
      "Scaffolding, fixtures, mocks, dry runs, or structure alone."
    ],
    "do_not_smooth_over": [
      "Ambiguity, uncertainty, or missing evidence with polished wording. The system must preserve uncertainty."
    ],
    "do_not_preserve_without_approval": [
      "Compatibility shims for earlier scaffold layouts unless explicitly approved.",
      "Legacy behavior, donor-code assumptions, or compatibility shims unless explicitly required."
    ]
  },
  "architectural_shape": {
    "required_runtime_surfaces": [
      "CLI entrypoint.",
      "Deterministic orchestrator.",
      "Role contract loader.",
      "Context compiler.",
      "Agent caller.",
      "Schema/report validator.",
      "Run artifact writer.",
      "Deterministic runtime probe.",
      "Worker adapter boundary.",
      "Policy/spec source loader.",
      "Implementation project state surface.",
      "Archive surface."
    ],
    "required_evidence_boundaries": [
      "Role contract versus runtime_outputs schema.",
      "runtime_outputs schema versus returned report.",
      "Project spec versus current user task.",
      "Invariant authority versus task authority.",
      "Scaffold evidence versus runtime evidence.",
      "Plan versus apply.",
      "Governance agent versus file-mutating worker.",
      "Model-generated claim versus deterministic probe result.",
      "Archived history versus active implementation state."
    ],
    "required_inspectable_surfaces": {
      "default_location": "../runs/<timestamp>/",
      "min_required_artifacts": [
        "task.json",
        "project_context_packet.json",
        "project_manager_report.json"
      ],
      "optional_debug_artifacts": [
        "Rendered prompt/debug runtime_inputs.",
        "Validation summary."
      ],
      "authoritative_context_artifact": "project_context_packet.json",
      "authoritative_pm_runtime_output_artifacts": "project_manager_report.json"
    },
    "dependencies": {
      "required": [
          "Python runtime.",
          "OPENAI_API_KEY or equivalent configured outside committed files",
          "Local filesystem artifacts under ../runs/**",
          "Local git availability where possible."
      ],
      "excluded": [
          "No external database.",
          "No network tool permissions other than the model API call.",
          "No web search by default.",
          "No shell tool permissions for agents."
      ]
    },
    "runtime_constraints": [
      "The first working implementation may be Python-only."
    ],
    "governance_primitives_constraints": [
      "The first durable representation of governance should be JSON-first where the source is object-shaped."
    ],
    "forbidden_surfaces": [
      "Treating archived bundles as active state.",
      "Treating missing optional sources as if they were present.",
      "Claiming runtime capability without runtime evidence."
    ],
    "deferred_surfaces": [
      "Planner route.",
      "Adversary route.",
      "Reviewer route.",
      "Implementer route.",
      "Archivist route.",
      "Codex CLI worker adapter execution.",
      "File mutation outside ../runs/**",
      "Multi-agent routing.",
      "Apply workflow.",
      "Cost/budget enforcement beyond a first budget policy.",
      "Provider abstraction beyond the first OpenAI route.",
      "UI beyond terminal runtime_outputs.",
      "Invoking non-PM agents.",
      "Editing repo files through an agent.",
      "Allowing an agent to inspect files directly."
    ]
  },
  "runtime_discipline": {
    "must_exist": [
      "Loading project_manager.agent.json",
      "Compiling project_context_packet.json",
      "Sending the structured packet through the PM route.",
      "Receiving a structured PM report.",
      "Validating the PM report.",
      "Saving required artifacts under a timestamped run directory.",
      "Running a deterministic probe over those artifacts.",
      "Printing a truthful terminal summary.",
      "Stopping before implementation."
    ],
    "meaningful_progress_metrics": [
      "Role contract loading.",
      "Project Context Packet structure.",
      "Schema validation.",
      "Runtime probe reliability.",
      "Artifact inspectability.",
      "Permission enforcement.",
      "Routing determinism.",
      "Authority separation.",
      "Cost/budget visibility.",
      "Clean transition from plan to later apply."
    ],
    "authoritative_boundaries": {
      "authoritative_sources": [
        "User requests.",
        "./governance_primitives.json",
        "../runtime/runtime_doctrine.json",
        "../runtime/runtime_budget.policy.json"
    ],
      "authoritative_memory": [
        "../implementations/**",
        "./known_failures.json",
        "./open_decisions.json"
      ],
      "agents_must_respect": [
        "The current filesystem state of the repo.",
        "The current git state where available.",
        "The structured files under ../project_spec/**",
        "The structured runtime budget under ../runtime/**",
        "The structured role contracts under ../agents/**",